137,今日中日新聞の1面トップに大見出しで「子供の感染重症化も」「疾患なくてもひどい肺炎」という記事が出ました。福本英司記者の署名入りです。話し手は、愛知県大府市の「あいち小児保健医療総合センター」総合診療科の伊藤健太医長。伊藤医長によると「第5波に比べ、感染者の増加に伴って子供の重症者も増えたという。重症化した子供は様ざまで、感染後にぜんそくなどが悪化したり、基礎疾患がなくてもひどい肺炎を患ったりしたケースがあった。」・・結論は予防接種を打て！　ファイザーがらみかどうか？後遺症はワ○○○を忘れたころにやってきますよ。癌、不妊、免疫がなくなる・・・,2,sunshine911,0
138,CBCはこれまでの煽り一辺倒の偏った報道を連日、繰り返し繰り返し行い続け、視聴者の本来冷静であるべきマインドを壊したことを認めなさい。,0,おがわだいせん,0
139,やるやんけ,5,れんたん😎,0
140,この人、金メダルかじった人じゃないの？,4,Kan Kan,0
141,マッチポンプだけど、ないよりマシ,1,Anton0220,0
142,まだマスクしてんのw,6,R E,0
143,あれコメ消されてるやん,0,キムムーキムムー,0
144,これでまた医療利権が潤うんですね,8,超人,1
144-1,早く利権を無しにしていただきたい。もう薬はいらない。　西洋医学もいらない。　何が病気の元になり何が悪化させているのか、国民は気付いていかないと　いつまでもイタチゴッコ。,6,あーあの頃が懐かしい(*´-`)
