1,こんな勇気ある市長に守られてる泉大津市の方々が羨ましいです。,618,ファミリー道産子,0
2,大臣に言いたい。「痛いか、痛くないか」そんなことが問題なのではない。南出市長さん応援しています！もっとメディアは副反応について語るべき。もっとワクチン接種で苦しんでいる者たちのことを語るべき。,300,ハッピーハッピー,0
3,本当の市長って、こういう人の事を言うんじゃないかな？素晴らしい市長さんです✨もっともっとこんな市長が増えて欲しい。,577,岩瀬正典,1
3-1,私もそう思います🙏,3,Yuki Healing Yoga & Shiatsu
4,日本人の悪い所は「みんながそうしてるから自分もそうしなきゃ」とか、「周りはやってるのに貴方はやらないんだ。」とか揃えようとする所。,1959,ヌゥンヌゥイ,30
4-1,@デンチュラ いい事も人によって立場や視点で変わるからね。,6,ホセムヒカ　リスペクト
4-2,いいことは足並み揃えるべきだと思うが,1,デンチュラ
4-3,そして、(経済を殺すだけのマンボウでもそうだが)間違いがあってもそれを認めたがらずに突き進む。「謝ったらﾀﾋぬ病」に罹ってることだ。,1,マイネルファンロン
4-4,@門の星ちゃん いえ、私の住んでる世界では間違いないくあります！都内や若い人達に囲まれているのでは？,4,ホセムヒカ　リスペクト
4-5,そんな風潮ありません被害妄想する方が多いのは事実,0,門の星ちゃん
4-6,@12g- B7a アドレノクロムですね！,1,ホセムヒカ　リスペクト
4-7,@12g- B7a  だから、調和することは社会生活上大切なこと。しかし、そうすることが支配者にとって都合がいいからそう呼びかけられているのか、間違った方向に進んでいないか、自分の頭で考えないで付和雷同なのはいけないよねって言ってるんだけど。,3,み。
4-8,@だいちゃん 様素晴らしいお父様ですね😆👏👏👏✨,5,ぬんたのさんきぬ
4-9,@さゆち 医療従事者の場合って未接種は周りにわかるんですか？嘘が通らないなら辛いかも▪▪一般人なら嘘も方便で丸くおさまりますが,3,pia non
4-10,@み。 そうですよね。何も考えてない証拠。,4,友利優
4-11,考えることより暗記の教育だからね。だから意図的にそういう人にさせられたということ。その方が上は都合がいいし。子供の時から親や先生がそういうことではないと言って貰えるような教育受けない限りそういう人ばかりになる。そうでなくても気付く人は気付くけど、なかなかいないんじゃないかなぁ。,11,sana
4-12,@ホセムヒカ　リスペクト さまもしかして、あどれの採取に参加ぐら変ですか❓️,4,12g- B7a
4-13,そう言って日本人の悪い所と言う所が日本人の悪い所な気が…で､一番の悪い所はマスコミさんでしょう､あんだけ煽って居たのに､ロシア侵攻で得意技の掌返し炸裂wホント糞だな!!,21,丸丸
4-14,その考えだと日本国民は全員打ってないとおかしくないですか？ちなみに自分は日本人ですが打ってません。周りからも別に何も言われてません。,24,攻撃力10防御力0
4-15,@さゆち ワイの知ってる医療関係者にも何人かいますよ気にしなくて大丈夫自分の判断を信じたらいい👍そして、人を助けるお仕事、いつもありがとう😃,64,ヒロヒロ
4-16,ヌゥンヌゥイさん。私も同感です!　NOと言えない日本人…　右に習えで…　私は元々、人に合わせるのが嫌いな方です😄,35,ひとみ たかはし
4-17,医療従事者だけど、ワクチン打ってないの病棟で私だけ笑,137,さゆち
4-18,０・100思考と善悪二元論でしか考えられないアホな方々が多いですね(笑),36,shinya9
4-19,@だいちゃん  素晴らしいお父様ですね❣️😊👍,107,kikichna1616
4-20,私の父は「99%が『Aが正しい』と言っても、お前が『絶対Bが正しい』と思うならBを選べ！」と育ててくれました(^-^;;,242,だいちゃん
4-21,和すること自体が単純に悪いこととは思わないが、そうした方がいいかどうかを自分で見極めずに他人の判断に合わせるのは良くないよね。,136,み。
5,泉大津市の人口は減らないし病気の子供達も多くでないですね最後この市が勝ちます素晴らしい展望を持っておられる市長さんに感謝ですね,850,熊野みち,1
5-1,泉大津市に引っ越す人がふえればニュースになりますかね😃 アメリカでは義務化した州からしていない州にかなり移動があったと出ていました。去年までの話ですが▪▪もしこのまま二分する県や市が出て来たら日本人もドンドン行動すべきです❗️,22,pia non
6,泉大津市長の御判断に感謝と敬意を申し上げます。ABC放送にも現時点で出来得る限りの報道をしていただき感謝致します。,578,Tジャックダニエル,1
6-1,名古屋のCBCに続いて、ABCも「真実」を報道し始めたのは素晴らしい。全国ネットの「圧力」に負けず、他の地方局も続々と続いてほしい。,36,asibagu3
7,しっかり情報を集め調べようとする市民が増えていく、と思います。それが大切だと思います。,661,阿久津清美,2
7-1,ほんとこれ。要は自分で調べろって言ってるだけやんね。脳死で判断放棄してる国民が多いのが問題。打つか打たないかなんて、自分で判断しろよ,6,B A
8,吉村知事はとにかく打たせることを目的とし、大泉津市長は子供の命を守ることを目的としている。,1360,Takuro Sakazaki,30
8-1,吉村知事は顔だけだったな,1,チロル
8-2,大阪知事、市長は利権がわだから  打てと進めるのかもですね⁉️,1,シエル 水嶋
8-3,@0226 daisu え？もともとです。維新の会ですよ？,0,Jun
8-4,@入江通雄 さまそうでしたね。忘れちゃいけませんね。あの最初の橋下から何が変わったんだろう？太田元知事は苦しい財政から8300万の退職金貰って今は参議院議員。懲りないね〰️。本人も国民も😱,4,しろまる
8-5,@しろまる 様吉村に対する意見は同意しますが、大阪自民の評価には同意できませんね。大阪が破産寸前までになったのは彼等の責任ですよ。,2,入江通雄
8-6,@ひとみ たかはし バカにしてるでしょ❗まあ、いいですが🤭🤭🤭🤭🤭,0,かいとさえこ
8-7,@pia non バカにしてるでしょ❗まあ、いいですが🤭🤭🤭🤭🤭,0,かいとさえこ
8-8,@かいとさえこ さま。あなたは、大変素晴らしい方だと思います。　あなたの様な、素晴らしい人に一度なってみたいです,1,ひとみ たかはし
8-9,@バラエティ 一部の市職員の裏口入庁疑惑や資金の不正使用などの疑惑も浮上している市長です,0,ジャスタウェイジャスタウェイ
8-10,@バラエティ 維新の衆院議員・遠藤敬が支援されてます。,0,ジャスタウェイジャスタウェイ
8-11,@ジャスタウェイジャスタウェイ さん南出市長さん維新だったのですか。自民党でも左派からリベラル、保守とまぁ様々ですから維新も有り得るんでしょうね。,1,バラエティ
8-12,@かいとさえこ あなたは幸せな人です,8,pia non
8-13,@pia non 子供に接種させるのは、家族で話し合って決めることだから、あなたがとやかく言うことではないよ🤭それに、吉村知事何も可笑しくないでしょう。  大阪のためにあんなに動いているのに、酷い言い方。,3,かいとさえこ
8-14,@ひとみ たかはし 子供に接種させるか、させないかは、親が決めることだから、あなたが何か言うことではないですよ。吉村知事は何もおかしなことはいっていない。そして、接種券は郵送することには何の問題はないと思いますが…。,1,かいとさえこ
8-15,南出市長も吉村知事も維新の方なので根本は同じですけどね,3,ジャスタウェイジャスタウェイ
8-16,大阪府民ですが、泉大津市です。大泉津という地名はありません。,4,黒法師
8-17,大泉津,0,鷲ぬこ
8-18,吉村なんて橋下の子分やん,31,アマウツシ
8-19,吉村の眼を観て。ゾッとします🙇,57,しろまる
8-20,なぜ当たり前のことが出来ないのでしょうか？,25,ウズベキオジサン
8-21,あいつはだめだ,27,閑人のつぶやき
8-22,誰かお金持ちの人、政治の世界で言う所のカバン用意してくれません。次の知事選で南出市長に勝ってもらう為に。それともこれを見てもまだ大阪府民は維新の会が必要ですか？,57,H M
8-23,あの方は、おかしな事だらけですね〜!😅　イソジン…。自ら３回目接種の腕のモザイク…。是非とも打ってほしい!なんて!　勉強しとるのか?　子供達の事、何も考えてない!　人間性に欠けているとしか言えない!!😡,122,ひとみ たかはし
8-24,吉村は終わってる笑,135,0226 daisu
9,南出市長さんの対応はとても誠実に感じます。多くの御苦労や弊害があることを推測しますが、正しいと思ったことにブレずに信念を貫き通す志をもった南出市長さんの様なお方がこの国のリーダーになるべきです。,1686,エルエス,26
9-1,@寒豪 マウントではなくガラパゴス化している田舎に現代の文明と価値観を導入しているだけですよ^_^,0,ゴールドスタンダード
9-2,@かなと うーん、ワクチンの副反応の確率は変わりませんが、そういうのではなくてワクチンの原理を理解できた上でものを言っているかです。,0,ゴールドスタンダード
9-3,@ゴールドスタンダード令和の時代に住んでる場所でマウント取るって言うダサ過ぎる行為を平気でやれる神経が信じられない。,0,寒豪
9-4,@モーリータミー それどこの田舎町ですか笑私、大学病院で働いてる医療従事者だけど東京都の医療従事者は99%打っているデータありますから笑ちなみに議員の方々もVIPルーム来ますが今のところみなさん打ってらっしゃいますよ。,0,ゴールドスタンダード
9-5,@ゴールドスタンダード お医者さんも打っている人は４０%だそうです‼️国会議員だってわからない‼️,2,モーリータミー
9-6,@ゴールドスタンダード 脳内憶測妄想ヤバww,4,魂の 薔薇色
9-7,反ワクチソの恐れとは、無料ってとこかな。1回1万円ぐらいで有料(保険外)にしときゃあ何も問題無かったんだ。,3,12g- B7a
9-8,@ゴールドスタンダード 返信ありがとうございます！人1人の、体なので、大丈夫な人も、いれば、そうでない人も、います！貴重なコメありがとうございます！,0,かなと
9-9,@ゴールドスタンダード 貴重な、ご意見ありがとうございます！でも、金持ちでも、貧乏でも、ワクチンの、副作用！後遺症は、関係ないと、思います！,8,かなと
9-10,@hukudon4869 わかります。クソ田舎の閉鎖的な思想が見ててしまいましたね。,1,ゴールドスタンダード
9-11,@山村裕美 大津とか静岡とかクソ田舎の考えこえー。,1,ゴールドスタンダード
9-12,クソ田舎の閉鎖的な思想ですな。怖いわ。,1,ゴールドスタンダード
9-13,@hukudon4869 　さまならないと思うが、何故わざわざケチを付けるんだ。,8,12g- B7a
9-14,南出市長さん！素晴らしい！大人も、子供も、ワクチン接種差別は、やめて！お願いします,34,かなと
9-15,言い過ぎましたね。理想のリーダー像ってことが言いたかったんです。,36,エルエス
9-16,誠実なのは理解できますが、経験やマニフェストなどを読まずにこの報道だけを見て「国のリーダーになるべき」というのはどうなんでしょうか…？,9,hukudon4869
9-17,あきる野市にも来て欲しいです💝,38,カルティエパンサー
9-18,是非静岡にも来てほしいです,67,山村裕美
9-19,神戸で開かれたコロナワクチンのシンポジウムで南出市長さん本人の生の声を聞いて来ました(ﾟ∀ﾟ)ﾉｼめっちゃ良かったですよ！応援してます♪,135,KINOpic
10,南出市長このような姿勢を貫く上で大変な圧力もかかることと思いますが、自分を滅し市民の為に活動し続ける、こういった首長さんを私は信頼し尊敬します！！,1373,303 Hachimantai,4
10-1,同調圧力になるようなことをするなと言っといて自分らは同調圧力かけている政府首脳。ホンマ情けない,19,sslarker
10-2,政治の世界はこちらからは見えない事柄が多いことは同意します圧力がかかるなどの表現は特に見当たりませんが、なにを根拠にされているのでしょう？,6,hukudon4869
11,慎重で良いと思う。打つ打たないは子供の家族の問題で、強制的に接種券を送り付ける方法は良くないと思う。接種券が来たら打たなければって言う見えない脅迫でもある。,1524,EVERYパパ,27
11-1,インフルエンザのワクチン打っておこ,1,Yooo mooo
11-2,a:俺みたいに受けないで欲しい,2,くろさわ【黒澤】
11-3,接種権が送られてきたら、破いて捨てれば良いのだと思います。,2,mutsumi marika
11-4,@hukudon4869 ダニエル社長の週刊ニュース後は自分で探して下さい。動画の最後の雑談の場面で語られている。医師で元厚労省のキャリアは中村氏。,5,H M
11-5,@H M 出されるものが抽象的な出自でよくわかりません。時間内にワクチン接種会場を開催するにはお金が必要です。また、通常の診療とは別に、ワクチン接種に時間を割いている医療従事者の方に対価を支払うのは当然です。なんの動画ですか？動画制作者の知り合いの医師という方はどなたなのでしょうか。また、動画制作者は医療関係者ではなく、その動画製作協力者が医師で元役人とのことですが、どなたですか？動画を出されているのなら教えていただきたいです。,0,hukudon4869
11-6,@hukudon4869 その事も動画作成者が自身の知り合いの医師から聞いた話で出てました。２０万には届きませんが、しかも半日での。要するに、注射する医師不足解消の為にとんでもない無駄遣いをしてるという話。なおこの動画作成者は、医師で元厚労省の役人であった人と動画作成をしてます。金になるという事の意味も教えましたよ。,5,H M
11-7,@H M EUの公的医療保険機関というのは、欧州医薬品庁のことでしょうか？ここからは欧州医薬品庁という体で進めさせていただきますが、そこではワクチンの効果は9か月(6ヶ月の有効期間+猶予期間)という見解で、初回のワクチン接種2回の後3～4ヶ月という間でのブースター接種は免疫に負荷をかけ、免疫反応へと繋げられないことを理由としています。その中でも例外として、免疫不全疾患のある方に対しては、すぐに接種するべきという見解です。危険だからやめるという話ではありません。ですが、フランスやドイツでは3ヶ月を間隔に、その他のEU加盟国でも4ヶ月を間隔の目安にしています。欧州の専門機関と各国との間で動きのズレがあるようです。これらは注視していく必要があります。,0,hukudon4869
11-8,@hukudon4869 論文というか、子どもの接種でどのようになるかはまだこれからデータが出てくる段階ではないでしょうか。また論文にも色々あることは確かです。こういった問題は、初めに結論ありきではなく、論証レベルや客観性、そもそもコロナ騒動の発端となっている論文が論文の体を成しているか、どういうタイミングで出てきたものか、PCR法開発者が生前何と言っていたか、などが根本的な鍵になってくると思います。アメリカVAERSの調査では、過去の例で実際に報告の上がっているワクチン有害事象は1%に満たないと報告されています。日本も厚労省のリモート会議内容が流出し、少なくとも報告の10倍の被害者がいるであろう事に言及されていました。死人が出ればもっと論調も慎重になっていい筈ですが、緊急性や公共衛生のためという大義名分にごまかされている部分がないか。やはり結論ありきの目眩しがないか、どれがcontroled opinionであるのか、慎重になりたいところです。日本政府は、製薬会社に6億8000回分のワクチンを注文してしまいました。全て消費できなければ、別途違約金を追加でとられる契約のようです。薬であれば希望者だけで良い筈ですが、今回のワクチンは、まだウイルスがよく分かっていなかった筈の2020年4月には、なぜか国民全員がワクチン接種する事を目標とすると、厚労省でとり決められていました。強制となればもはやこの国は民主国家ではなくなりますが、今のところまだ基本的人権もかろうじて残っていますので、表面上は民主国家の体裁を保てています。そろそろ、昨年末までの人口 動態 統計が公表されてくるでしょう。そうすれば、超過死亡の極端に少なかった前年2020年と比較して、もう少し色々な事がはっきりと見えてくるかも知れません。,14,aimi 7
11-9,知人看護師が集団接種会場　医師時給2万　看護師7000円　東京はもっと高いらしい。町医者は1人 相当貰えるらしい。税金の無駄使い！,9,川崎恵理子
11-10,@hukudon4869 何が問題でそうなっていて、それに対するあなたの意見はという部分が全く分からないのですが。,10,H M
11-11,@吉田美由紀 業務妨害の意味で使っていました、その意味で捉えてくださいまた、開業医は自営業ですよ,7,hukudon4869
11-12,@hukudon4869 営業妨害とは？お医者様は営業なのですか？,12,吉田美由紀
11-13,開業医の元に「子供を脅かす気か！」と営業妨害する行動が出ていますが、行動による脅迫です「家族の問題」という一言では片付けられない問題が逆に起きていますよ,13,hukudon4869
11-14,@新田重樹 😆👍️✨,35,pia non
11-15,今、破棄しました券,98,新田重樹
11-16,尾身ちゃんに対して効果はよくわからない。けど打て打てどんどんって、行政に責任はありませんよ。責任は親にありますってさー、本当に無責任ですよね。よくさー科学的根拠って言ってましたよね。今回はその科学的根拠示さないのかね。,67,いちごあいす
12,市長の賢明な対応良いですねそしてそれをちゃんと流してくれるこちらの局良いですね今更という人もいるでしょうけど、それでも少しずつでも広がってもらわないと被害にあってる人達が報われないですからねメディアはもっと頑張れ,1445,黒岩真司,1

13,とても良心的な市長さんですリスクもきちんと周知した上でそれでもという方だけが申請して接種すれば良い一斉配送は本当にやめて頂きたい同調圧力にしかならない接種は個人の自由,877,さとちゃんあきちゃん,3
13-1,誰も打たなければと思うお前らに押し付けてない,0,まろん
13-2,届いても届かなくても打った人がいれば　俺打ったんだっていうやつは必ず出ますよ。結局は同調圧力になるんだよなw,19,ひろちゃんチャンネル
13-3,@正夫 数田 様その通りなのですが、届いたら打たなければならないと思ってしまう人が多いのが事実,62,さとちゃんあきちゃん
14,メリットよりも少しでもデメリットがある時 その事を先に発信してくれるのは誠実,821,みーおちゃん,3
14-1,本当にそう思います。,13,みなこ
14-2,国はデメリット伝えな過ぎよね。芸能人使って摂取アピールなんか国民舐めてるだろ,28,あさささはな
15,こんな素晴らしい市長さんが居ることに感動した。後は単なる御用聞き、誰でも出来ることしかやらないなら別に必要ない。,562,次郎K,0
16,南出市長ははじめから一貫した姿勢を貫いてこられていますね！裏ではさまざまな圧力がかかっていると思いますが、それでも戦ってくださる市長に感服します。泉大津市の市民の皆様が羨ましいです！,980,ぱぴこ,1

17,素晴らしいです市長さん。お年寄りでも重症化の数は少ない様ですし、子供は風邪の子を信じて子供の接種はやめてほしい。,352,miyuwave,0
18,本当に素晴らしい市長です。ご自身の命がけで子供たちの健康を守ろうとしています。「異色な持論」でなく政府が隠している真実を発信して下さっているのです。,903,小林賢,1

19,南出市長はきちんとデメリットやワクチンの薬害に苦しんでいる市民の声を聞いている。行動で示してくれている素晴らしい人ですね！,472,ぬこさん,0
20,おそらく多くの困難の中での英断、かっこよすぎます😭。泉大津市の多くの子どもたちが守られる事になるかもしれません。本当に応援します。,248,m k,0
21,科学的根拠に基づいた考えをされ、市民の命を第一に思う素晴らしい市長さんですね。本当にこんな方に国政を担ってほしい。接種券を全員に届けるということは接種するのが当たり前と受け取ってしまう人が多い。重い副反応が出ている人達の存在を知りながら、国民にはっきり周知させない今の政治家達は、国民の命なんてなんとも思ってないのだと思う。,661,kimiichi,2

22,この市長さんのとこに住みたい！なにも考えずに上からの指示に従うだけの他の多くの市長を恥ずかしく思います。,219,cookie,3
22-1,アメリカでは義務化した州からしていない州への移動が過去にありましたね。日本人もこれくらいやらないと国は動きません❗️,4,pia non
22-2,しかも、3回目の準備をいち早くやる市長なんか、恥を知れ！と言いたい。,11,cookie
23,南出市長「5歳から11歳の子供に接種するのは狂気の沙汰でしかない」と言ったのはすごいし、政府やよその都道府県知事、自治体の長もそう考えた方がいいと思います言われたからやる  ではなく、デメリットをしっかり考える事、これはすごく大切だと思います,894,UP PWR,4
23-1,他の市町村長は、ほぼ言いなりですね。接種券を送ってしまうと、「世間」では強制と思ってしまって券が来てない他の人にも「まだ打ってないのか」と言われてしまってさらに強制の波が広がってしまうので、はがきか何かで告知して希望者だけ券を送る方がいいです。それこそ、個人番号を生かす機会ではないかと・・・。,7,越後屋康介
23-2,南出市長さんの勇気ある行動を尊敬致します。ある意味命をかけて市民を守るために見えない圧力(製負も含め)と闘っておられるのだと思います。雪駄⭕券を送らないという案は素晴らしいです。何も考えずに出かけてしまう羊さんが多いですからね。,39,mabo -parakeet
23-3,おっしゃる通り、言われたからやるでもなく、デメリットだけを見るのでもなく、本当にワクチンのせいで亡くなったのかどうかの情報収集などをして接種してほしいですよね,20,hukudon4869
24,この市長は、素晴らしいですね！裏での圧力に負けないでください！テレビなどでも、もっととりあげるべきです‼️,245,yuko amamoto,0
25,同調圧力、そこまで考えている事が素晴らしい。厚労省のデータはテレビで出ない。エビデンスもないと国が認めている事を知ることすら出来ない日本。今後も頑張っていただきたいです。,249,hirameg ヒラメグ,1

