382,橋下徹の娘さんは打ってないからな。吉村知事、自分で送っといて最後は市町村の権限ってひどいよね。,0,たまよ県,0
383,副反応が出やすいモデルナを推し進める政府がいかにバカが分かる,2,EXILEエバーグリーン,0
384,素晴らしいですね！,2,公美子,0
385,こういう人を見習えよマジ素晴らしい人だよ、どっちの意見も尊重して負けないであなたはひとりじゃない,5,モコニャンズ,0
386,素晴らしい！,2,田中かすみ,0
387,テメーが自分の体に打て！！堀内！！！,56,ゲゲゲの猫娘,7
387-1,@pia non さん。ニンニク注射とかね🤣,1,Norma
387-2,打つとしたら、栄養剤打ってブクブク太るw,2,pia non
387-3,こんにちは。読み返してみたら誤字だらけですいませんでした。本当に抗議したいです。緊急事態だって言ってマンボウだとか馬鹿らしい事ばかり実行しているくせに自分達はぬくぬくと美味しい立場にいるのが許せません,0,Norma
387-4,100万回くらい打って欲しい,1,だいちゃん
387-5,@Norma はっ??なんなんそれ? その情報、本当ですか!?もし本当ならその法律に賛成した者全員259行き確定。,0,山康之
387-6,そうそう!その通り👏👏👏私達、国民がその事実が本当かどうか?本当ならどういった理由でその法律を決めたのかぜんこく放送で国民に説明していてもらいたい!こういった抗議はどこにでもいけるドアメールすれば良いのかしら?,5,Norma
387-7,議員は打たなくて良いという法律作ったそうですね！何なんでしょうか？良いものなら一番先に打つだろう議員たちが打ちたくないって良い加減にしろです。,14,このはなゆり
388,安易に子供にもワクチンをと急ぐ政府。このような市長がいることに嬉しくなります。これからの子供の免疫力がどうなるのか心配です。,0,ゆっき,0
389,頑張ってください❗️❗️,2,キャプテンM,0
390,良い判断。素晴らしい。打つ価値ほぼなし。,5,ベロニカちゃん,0
391,未来の日本を守りますます。ありがとうございます。,1,柳澤信雄,0
392,南出市長は真のリーダーです。ホリウチさんはあり得ないという事です。後で責任をとることになります。逃げないでください。,5,cars,0
393,素晴らしいですね,3,都市伝説と陰謀,0
394,南出市にお住まいの方は幸せだと思います。こういう方に市長・知事になっていただきたい。,1,朝田美穂,0
395,なぜ「異色の持論」とわざわざ誘導するの?,7,ぷとりす,0
396,早く気付いて！取り返しがつかないことになる。1400名の死亡者尋常じゃないです,4,坊マー,0
397,泉大津市が正解ですね。,5,江田島平八,0
398,吉村も、あちら側の人間の証明だね。,5,新田重樹,0
399,南出市長のような方に政治をやっていただけることがしあわせです。,5,私のひかり,0
400,南出市長  頑張れ‼️,3,scarecrowかかし,0
401,頭の固い政府より　一部を除く柔軟性の高い自治体、市長の存在のほうが増えましたね,3,chas,0
402,大人を守るためにうたせるにはリスクが大きすぎる。・・・私も初老になりかけですが子供に守られてまで長生きしたくない。反対にこれからの我が国を担ってくれる子供たちを守ってあげたいくらいです。,0,ジョー,0
403,日経の力ってすげぇなぁ,1,五穀,0
404,いい市長だわ,3,lala shi,0
405,愛知にもきてくれー河村市長頼む,1,a7 Audi,0
406,素晴らしい👏,9,nana ymd,0
407,子供の接種券捨てました😉👍✨必要なしですよね☺️なぜ元気な子供に打つのか意味がわからないですね。,5,723,0
408,副反応や後遺症があるから打たないのでは無く、そもそも５６７なんて無いからです！ｗ,5,M M,0
409,南出さん、素晴らしい！全国市長見習え！,2,Makonaka,0
410,素晴らしい判断です,2,55 kh,0
411,この市長は偉い❗️勇気ある❗️,4,モネ,0
412,命を大切に思うことができない大人がいる。,2,m ii,0
413,泉大津市が羨ましいです。うちの市長は…はぁ〜…,2,もぐもぐ,0
414,ワクチンの副反応が熱とか意外にもある点を公表して欲しいよねー認知されてない副反応に対して国がどうゆう対応してるのかテレビでやってよーその上で国民には選ぶ権利があるよーーワクチン自体人体実験をきちんとしてるのかって話だよね笑笑動物実験しかやっぱりしてないんじゃないの？？誰が好き好んで人体実験をやりたくないなー,1,β AA,0
415,南出市長のような方が、今後の国政に携わっていただきたい,2,宇宙のきゅーちゃん,0
416,「狂気の沙汰」は言い過ぎだが、親は子供に対する責任を十分に果さなければ絶対にいけない。私は自己責任で接種したが、(十分なデータが揃うまでは)子供に接種させない。,1,Isamsam88,0
417,堀内大臣自分の言葉を深く自覚しどのような副反応が出ているのか無視せず見つめるべきだ！,7,なえやま,0
418,それでも思考停止の親は多い。国が自治体が推奨すると信じて疑わないのだろうね。老人、基礎疾患持ちは接種するだけの意味はあるとは思うが、私個人は3回目は止めた。,3,渋谷英一,0
419,南出市長に本当の政治家の姿を見た！これこそ正に政治家の鏡！,3,翼spirit【真理探求ch】,0
420,ひとりのお子さんでも長い間後遺症で苦しむ可能性があるなら慎重に判断する方が居ても良いと思う子供や妊婦さんには日本製のワクチンをせめて打って欲しいと思う,0,鷹雷鳥,0
421,5:24「受けやすくするような努力義務はないわけですけれども、できるだけ受けやすくするという意味で」進次郎構文かな？それを強制と言うんじゃい！子供同士の同調圧力の強さなんて知ってるだろうに。,1,velda 777,0
422,実際、接種会場で若者が気分が悪くなってぶっ倒れている子供たちがいます。治験＝実験なのになんで半強制にするのか？腑に落ちない。,4,山本三助,1
422-1,私はワクチン打ちたくない派ですが、アレルギー反応以外だと迷走神経反射が原因で倒れた人もいると思います。,1,空マンハッタン
423,素晴らしい市長さんです。,8,yasu iso,0
424,事実、身近に接種で障害が起きた人が数人います。かなりの確率です。,0,す,0
425,副反応の隠蔽するな！責任れ！,2,KON KON,0
426,これは拡散されるべき,2,ゆう,0
427,死亡率も低いので、わざわざ小さなこどもたちがリスクがあるのに打つ必要はないと思いますけど。,2,na xixi,0
428,この先　真実を知ったやらせてしまった親御さんは　どこに怒りをぶつけるのか…,1,幸子 岩原,0
429,子ども達に接種は必要ないと思い続け、周りに流されることなく意思を貫いていましたが、自分の行動に自信を持てました。この勇気ある動画に感謝します。,0,yumami w,0
430,良い判断です✨,4,R N,0
431,素晴らしい市長さん！,4,hirogp,0
432,まじ？素晴らしい！まじ、まんじー！！卍ほとんどの公務員が洗○されてる中で、されてない人もいて、さらに行動できる貴重なお人やん。南出市長に、勇気ある市長賞あげたい！副反応を教えてあげてとかって、呑気だよね。寝込んだり、万が一、死んだら教えられへんがな。┐(´д｀)┌ﾔﾚﾔﾚ,2,百人一首,0
433,このような報道に感謝致します。川崎市の介護施設にお勤めの方が施設入居者の方が接種後、帯状発疹が多数の方に出ていて、これは何なんだという話になっているらしいです。機会がありましたら、取り上げて頂きたいです。,8,みっきーみっきー,0
434,南出市長を支持します！こんな市長が全国で増えてほしい！子供にぜったいに打たないでほしい。,6,28 ARIGATO,0
435,全体主義的思想の吉村知事にはいずれ責任取って貰わないといけませんね。,6,S U,0
436,ようやく‼️本当の政治家が出ました本当に嬉しい😃✨です,1,近藤綾子,0
437,5:38 解りにくい情報発信や副反応のリスクをしっかり報道せずに保護者の判断とかいう無責任。悪どいなぁ〜子供かわいそ,1,Ue Naka,0
438,適正な判断だと思います。,3,啓二 加地,0
439,まともな判断だと思います。,1,ayu AYU,0
440,この事でこの市長辞めさせられたら許せない,2,EXILEエバーグリーン,0
441,確かに、副反応とか副作用とか怖いですね。,0,3103shinsan,0
442,泉大津市長　頑張れ！治験されていない薬剤は反対！,6,一男 和久井,0
443,こういったことを放送してくれたことが珍しい。,5,kinky4who,0
444,かっこいい ｢大人｣とはまさにこういう方です。大人はあくまで未来ある子供たちの盾でなければならない。｢将来の子供のため｣とき言って、子供の未来を売る大人など人間ですらない。,1,テリー,0
445,かわいそうな子治験が終わってないのにエビデンスがあるわけない。あるのは接種した人に出た症状だけ。まあ、接種したら自己責任だからねー。接種後にどんな症状でても文句言わないでねー。,11,angel presents,0
446,１割の子が学校に行けない、1ヶ月後に、抗体効果１割に下る。自然免疫はもち下がる。分科会は何が目的?,7,Shingo Nakamura,1

447,今回子供用の中身には添加物トロメタモールが追加されましたが、だいじょうぶですか？モデルナに入ってる添加物ですがだいじょうぶですか？大臣もおっしゃる通りエビデンスないんです。最短でも来年５月まで治験は続きます。保護者さんは判断を間違わないで下さい。,9,coco whitee,0
448,こういう本当のことを言う人ってだいたい消される。でっち上げの選挙違反で物証無しの推認だけで有罪になり政治生命を絶たれた政治家もいる。マジで心配。,3,Daisuke A,0
449,打ちたい人は打つ。打ちたくない人は打たない。これでいいじゃないか,5,zhen M,0
450,こどもは接種する必要はないやろ将来間違いなく免疫性疾患が増える親はよく正しい情報を収集して正しい判断をしてほしいです。国や自治体は責任もちませんよ泉大津市長さんは素晴らしい市長さんやで,2,野沢佳弘,0
451,打った子供が可哀想で仕方ない,2,チャーママ,0
452,大阪にこんなまともな市長がいたなんて…（大阪に失礼）,2,Codaです,0
453,なんて恐ろしい映像だ...いつまで副反応って言葉で誤魔化すんだ,0,NZXT,0
454,こんにちは😃ずーっと、情報を追ってきていますが、みなさんのお話する際に、ただ「重症化しない」「後遺症が怖い」という時の主語をはっきり「567の重症化」「ワク○ンの後遺症」と言わないと、大阪市の様な「簡単にワク○ンを打たせよう。」と言う無知な方(悪意があるのかもしれませんが)の作戦に乗せられてしまうと思います。子供にも理解できるような、初めて聞く人にも理解できるように、言葉を省略しない話し方をしていただきたいです。主語が違うと、誤解する事の大きい案件です。もしかすると、マスコミがわざと誤解するように編集して流しているかもしれませんが。,1,Japanese Gypsy（ジャパニーズ　ジプシー）,0
455,吉村知事、市民の生命、安全に責任のある立場でありながら、エビデンスのない実験段階の、薬剤を、小さに子どもたちに進めることになんの躊躇もない。行政の長である資格ないですね,1,停車場&,0
456,正しいか正しくないのかは、メリット　デメリットを天秤にかけて判断して欲しい。まずはテレビメディアの情報をおいといて、自分で辿り着く事が大切‼️,1,ユキズミ123,0
457,良い判断だと思います。,1,ロストワンデー70円の損失,0
458,南出市長は事実を伝えていらっしゃるし、国民の側に立ってお考えくださっている。,0,橋本良子,0
459,市長がんばれ！　応援しています！！,1,閑人のつぶやき,0
460,南出市長ありがとうございます❗どうかお体ご自愛ください😆💕,2,tom ton,0
461,会社も半強制辛いね,0,雅滋,0
462,吉村さんは、副反応について、見ぬふりを決めている。,2,chie,0
463,まともな人だ！！,2,長谷川博之,0
464,この市長いきなり失踪とか不審○とか事件に巻き込まれないで欲しい‥本気で消しに行く奴だっているでしょ？おかしいもん世界も日本も,3,いつもそこに,0
465,1回目のワクチン接種した日（7月の終わり）の夜、夕食後から寝るまで座ってパソコンをしていました。立ち上がって寝る前の歯磨きをしてたら、3分後くらいに急に力が入らなくなって、立っていられなくなりました。5分くらい動くことが出来ませんでした。その後何とか布団に入れたものの、体が暑くなったり、冷えたりの繰り返しで眠れませんでした。翌日は高熱が出て、3日目に３６．８度になったものの10分も歩けば疲れて歩けなくなりました。体調が戻ったのは、一週間後でした。,1,毘毅虚喪璃,0
466,南出市長の勇気に涙が出ます。強い信念を感じます。吉村さんは何故直で接種券を送付して貰いたいのでしょいうか？そちらの方が私は疑問です。,1,junon,0
467,普通だと思うけどなぁ異色ではない,4,時時雨,0
468,子供にダメなものは大人にもダメ！これだけ被害出てたら中止だろ！,1,shine sun,0
469,コロナ禍で南出市長の様に、当たり前の事をきちんと出来る人がいなさすぎる。南出市長に対して様々な圧力が来てると思うが、屈せずに市民の幸福の為に頑張ってくれる人こそが、国の中枢で活躍して欲しいものである。,18,えとうま,0
470,吉村さん、うまいこと言いますな。『最終的には市長村長の権限』だから勝手なこと言えるわな。,1,Su Su,0
471,赤紙が届いたというくらいの衝撃。,3,大好きな地球がんばれ,0
472,反ワクチンの陰謀論者はバカだと思っている私だが、この判断は支持する。,1,ゴンゴン,0
473,事実を黙殺する理由が何処から来るのか国際刑事裁判所に聞いてみよう,2,nama gusa,0
474,すごい逞しい市長さん👏こういうとこだぞ岸田総理😩,0,くまモン,0
475,本心は、神に通ずる。本心が、先生。,1,Hidehito Matsunaga,0
476,二回目のワクチン打ってから１ヶ月位たつが体調悪い,5,チャンネルハル,0
477,南出市長凄いです。他の市町村も見習うべきです。国が、送らなくても問題ないとおっしゃってるのに、知事が「受けやすくする」と言っている意味がわかりません。市長が、国会議員の前で○○問題、○○の沙汰のお言葉は胸に響きました。,3,ヤマガラ,0
478,👏🏻👏🏻👏🏻👏🏻,2,番長先生,0
479,素晴らしい市長さんです。支持します。,3,だいもも,0
480,このようなまともな人が少なすぎる！,2,Yuka S,0
481,良い政治家などは消されてるのはコメ欄見ててもほとんど知らないみたいですね,0,まろん,0
482,大阪府はワクチンを接種してリスクが出たら吉村さんが責任取れるんかな？そんな知識も力もないようにみえますが、無責任に言っているのか？責任は親にある以上よく考えて接種してもらう方がいいに決まっている。,1,HELLO HELLO JAPAN,0
483,役所仕事じゃない仕事する　珍しい役所の方ですね！一時が万事ほかの決定も、正しいかどうかで判断してくれそう。次も当選すると思った。,1,イチ,0
484,まともな政治家がこんな所におられましたよ！！,0,造園N,0
485,吉村さんよりこの市長さんに知事になっていただきたいです,2,モネ,0
486,何をそう恐れているのかわからん,2,tabu,0
487,南出市長の考え方賛成です!吉村知事、顔つきかわりましたね。,3,t.ma。,0
488,20-30代も鬼くそ重症化率低くて涙目,1,B S,0
489,この人は偉いね、　ついでにこのワクチンは効かないから全部やめたほうがいい。,2,そこ、気持ちいい,0
490,南出市長かっこいい！,3,tomozo shiiya,0
491,偏った報道w南出さん、頑張ってください◎,1,真一,0
492,吉村知事、南出市長の話聞いてる？聞いて理解してて、「送って欲しいと思います………。」なら、許せないね。良く大見得切ってあんな発言できるわ。元からこんな汚い人間だったのか、何かのせいで変わったのかは分からないけど。豊田商事事件の時の正義の味方が現れて、吉村君の所に行ってくれないかなあ。,2,H M,0
493,海外のワクチン接種率見てくれよ、、、,2,gho,0
494,子供に打たせるバカな親の顔を見てみたい,4,888 monica,0
495,吉村知事は自分の子供にうたせたのか聞いてほしいな。,9,ラリルレロ,0
496,最後、吉村知事の人任せ、責任逃れの発言で終わる動画（笑）,2,きっしきっしー,0
497,南出市長、エライ❗️このことは数年後効いてくると思う。,7,高田哲也,0
498,今遅くない後遺症見てないのかわいそうでした見てください,0,AppIe green,0
499,子供がコロナなった場合家族に責任があると言う考えなのか,0,則竹靖雄,0
500,吉村知事のコメントは意外だった。この発言で吉村知事は国側の人間だと判明した。,2,ハム星,0
501,こんな当たり前のことが言えない日本って、ロシアと変わらん。,4,t k,1

502,あ、やっぱり理解力が減ったりするんですよね。私の職場の人たちが、急激に理解力とか集中力が減ってきている気がしていたので。,6,S MIZUSUMASHI,0
503,この大臣は信用できない。,3,love and peace,0
504,副反応もこわいけど、コロナ後遺症もこわい。,4,べーぐる,0
505,切り抜きありがとうございます。,0,みんみん,0
506,死亡も、重篤副反応も多い。安全性が確認されてないし、データも揃ってないのに、なぜ行政が動いて接種を促すか？,1,とりこ,0
507,地元のローカル放送見ました、ある医院で６歳の子供にワクを打たせた母親のインタビュー(やっと子供に打たせる事が出来る様になって安心しました)、もはや接種に対する疑問は皆無ですね、この放送を観た他の母親も打たせたいと思うでしょうね。,0,vario roof,0
508,異色の考え❓リスクで考えたら普通の考えなのでは❓だって根拠ないんだよ？,7,五郎田口,0
509,「異色の持論」じゃないでしょう。常識だよ。泉大津市民がうらやましいよ。それよりも、接種券が送られて来たら「打たなきゃいけない」と無思慮に判断してしまう日本人の情けなさよ。,2,瀬崎吉廣,0
510,まともな人もいるんだな,18,ゆう,1

511,異色な見解って…いやいやイメージ悪くするなよなぁ,2,あんちゃんファミリー／日常配信,0
512,どこが異色な持論ですか。至極真っ当なお話ではありませんか。,13,Yoko,0
513,素晴らしい市長に、拍手👏,2,N M,0
514,👿の堀内💢吉村💢👍南出さん！素晴らしい！,6,泥舟狸,0
515,南出市長のような方が殆どいないのが不幸。日本の子どもの事を考えれば立ち止まるのが普通。安全のデータないんだから！,2,K K,0
516,吉村の顔、ひきつってるな。　魂を売った知事,3,Wood Rich,0
517,やっぱり若い人の方が良いね。,2,knj otb,0
518,堀内氏の発言、吉村氏の発言は、被害者がこんなにでているのに無視して、まだ国民に進めていることからして、国民は、おかしいことに気づかなければならない。南出市長は、大変勇気ある、国民を守る発言をされていて、全国の市町村長は、見習うべきです。,1,ハリネズミハリー,0
519,事務の効率化からすると、バカかと思う。申し込まなきゃ良いだけじゃん。というか、どんな薬も毒だから、熱が出ようが喘息と同等になろうが、この市長は一切薬を服用しないでほしい。,3,ら,0
520,吉村知事はお子さまが確か三人いらっしゃるので、もちろん接種されるのでしょうね。,3,koronlovesme,1
520-1,接種するとしたらインフルか栄養剤です,0,pia non
521,自己判断でいいと思う。,2,いつきなりみや,0
522,科学的根拠とデータに則った合理的な判断が「異色な持論」となってしまう現状が悲しいですね。吉村さんの「個人の判断なんだからとりあえず配っとけよ」も一見おかしくはないですが、背景として「政府から配られたらお墨付きみたいになる。そして同調圧力が発生する」という現実的な感情の部分は置き去りになっているかなと感じた。,0,s春樹,0
523,閣僚は誰も打っていないと聞きましたが本当でしょうか？堀内大臣のお子様は成人していらっしゃると思いますが、もし5歳だったら打たせるでしょうか？(お孫さんにでも)小さいお子様に打たせる事は大変恐ろしい事で先々必ず大問題になると思います。,3,rytask 7733,0
524,吉村さん残念です,2,藤田由美,0
525,どっかの飛行機遅らせるノミとは大違い,0,Mally Melo,0
526,本心が、先生。,0,Hidehito Matsunaga,0
527,打たせる親は頭がおかしい。,1,梶翔馬,0
528,ワクチン分科会副反応検討部会(2/18資料)のデータにはワクチンの副反応が原因とする死亡は無く、重篤症状について接種後に発生したモノを羅列しており、因果関係は別に評価している。,0,t n,0
529,みんな嘘に気付いて(>_<),2,ARIAさん,0
530,残酷だな、人体実験,3,kunpunogogatsu,0
531,実にえらい市長だ。普通の事だが。,1,avigan5 trump3,0
532,南出市長あっぱれ！言っておきますが、これが普通の感覚ですよ効果あるかわからんし何が起こるかわからんけど打って治験データとらせてはーいえ、打たないとか協調性なくない？↑私からしたらこっちが異常,1,ふぅ太郎,0
533,堀内お前よく笑顔で子供に打った感想聞けたなそれとも打たせたフリかなあきらかに堀内より市長の方が大臣に向いてるだろうが。,1,jjj kkk,0
534,南出市長は恐らく真実をわかってるんでしょうね。国の圧力があるでしょうから、やめろとは言えない。ギリギリの対応なんでしょう。立派です。こんな市長さんばかりだと、良いんですけどね。,2,サンチャイルド,0
535,南出市長以外の政治家は、接種した子どものうち何人かが重い副反応が出ても仕方がないって切り捨てるんだろう。最終的に接種を決めた親の責任、進めた国の責任って、責任転嫁をする政治家ばかりのなかで南出市長は希望。,1,Kuurin,0
536,「そこにあるのは毒饅頭かもしれませんよ」と、人として当然のことをしたまでの話。悪いことをしている後ろめたさが有るんだろうな、吉村の顔が引きつってたな(笑),4,jyunpei163,0
537,痛い痛くないの問題か？枠大臣1人が覚悟するものではないのですよ。よくお考えください💢💢💢,4,kotarou599,0
538,こわーい🥺,0,ケツ穴評論家,0
