48-13,全国有志医師の会のHPで真摯に診てくれる医師を探してください。一日も早い回復をお祈りします。,36,Keen Bobson
48-14,どの様な症状か分かりませんが、続いているなら病院で検査した方が良いですよ。,17,けい
49,どのメディアも情報を隠して摂取のみを促す中、現状を発信して頂き、ありがとうございます。やはり治験期間なので、公平な情報発信は気になります。このアナウンサーの意見も、何度聞いても涙が出ます。応援しています。,29,わっはっは,0
50,こんな事言ってくれるアナウンサーさんがいるなんて！感動しました。,13,にこたん,0
51,事実を包み隠さず伝えてくれてありがとうございます。もっとワクチン後遺症の患者さんの苦しみについて報道してください。本当にワクチンは安全なのか？今起こっていることを正しく知りたいです。,22,ぱふぇ。,0
52,サンテレビさん　頑張って発信を続けて下さい。　宜しくお願いします。　因果関係なし！と判断されて苦しんでる方々が沢山います。,30,安藤知康,0
53,最後、アナウンサーの方怒りが溢れて声が震えてるように見えました素晴らしい報道ですねこれが本来の報道だと思いますが,86,スキーバレー,0
54,素晴らしいです！声を上げてくださってありがとう。これからも視聴者に寄り添った公正な報道を！,233,C T,0
55,サンテレビさんありがとうございます、救われてる方たくさんいると思いますm(__)m,55,GT GT,0
56,ありがとうサンテレビさん兵庫県民として誇りに思う,53,yasusi iwasaki,0
57,因果関係を認めると都合が悪いからなんでしょう、本当に怒りしかない。サンテレさん有難う！,9,spirit 55,0
58,きちんと真実を報道して下さりありがとうございます。これこそ国民の知りたいニュースだと思います。私の身の周りでも数名体調不良の方がいらっしゃいます。また報道してください。宜しくお願いします。,7,ララキキ,0
59,神戸市とサンテレビ頑張ってほしい　全国の為に…,6,兵庫ウサギ,0
60,コロナ報道に嫌気がさして、主流メディアを見なくなりましたが、サンテレビさんと、藤岡勇貴さんを応援します今後とも、国民・市民に寄り添った公正、公平、公明な報道をお願いします,17,Mario Y,0
61,素晴らしい番組ありがとうございます！最近はTVを見ても何も信じられなくなってしまいましたが、このような番組がある限りまだまだ捨てたものではないなと前向きになれます。,165,Kenichi Takaguchi,0
62,この2年間ではじめて TV報道に共感し感動しました！真実を報道してくれて本当にありがとうございます！,39,hope sideman,0
63,アナウンサーの最後の勇気ある発言感動しました。頑張って下さい。,27,杉浦淳子,0
64,素晴らしい報道姿勢に心から敬意を表します。日本のマスメディアは真実を覆い隠し、時に嘘を垂れ流します、サンテレビさんは唯一無二の良心ですね。,4,川西敏弘,0
65,現実を伝える「勇気」に感謝します。伝える側も命がけな世の中。本当に・・・,24,shidoremi08,0
66,サンテレビも本当のこと報道してくれるから好き。,14,あき,0
67,圧力もあるでしょうに…素晴らしい真実の報道を有り難うございます。応援致します！,5,のりのり,0
68,ワクチン後遺症について政府は実態調査をせずに否定している。その通りです。岸田さんは口先だけです。政府の無責任さには怒りがわきます。このようなまっとうな報道をしていただいてサンテレビさんには感謝いたします。,12,effv,0
69,勇氣ある報道に感動しました。心のある方がいらっしゃることに救われた思いです。本当にありがとうございました。,26,aya Lemon,0
70,ガテン系元気いっぱいだった友人がワクチン二回目接種あとにリュウマチ系になり薬の副作用も相まって仕事完全復帰出来てません。男性では珍しいのとそれまで何でもなかったからワクチンしか考えられない、と言ってます。先生も、最近同じ症状の患者さんが最近増えたと言ってたそうです。,28,佐藤,0
71,報道ありがたいです🙏男性アナウンサーの最後のお言葉、涙が出るほどありがたく、心強く、励まされます‼️身近で本当に酷い接種後の病状を聞くにつけ、誰も責任を取れないのに、推奨だけされることに怒りと悔しさを禁じえませんでした💢どうか一人でも多くの方にリスクもあるのだということを伝えてください‼️,123,okryoko st.,0
72,サンテレビさん、他の主要メディアのようにメリットだけを報道するのではなく、ちゃんとデメリットまで報道されていて、素晴らしいと思います。信頼出来ます。このアナウンサーの方の発言にも感動しました。,48,えっちゃん高見悦世,0
73,公平な番組制作をしてくださってありがとうございます。ワク○ンの後遺症について追求する内容や、最後の男性アナウンサーの言葉はとても勇気がいるかと思います。圧力に負けずに、これからも公平な番組制作をお願いします。応援しています。,3,da-misa,0
74,このキャスターの意見が強い。感心しました。自分も今回予想以上の副作用で驚き、どう考えるべきかと思っている所、この動画が一つの参考になりました。,34,725 silent,0
75,サンテレビさん、報道機関の鑑ですね‼️関東ではこのような真実を伝える局が存在しません。国民にとっての悲劇です。今後も国民の利益となる番組作り、期待しています✨🙏,101,プルメリア 山田,0
76,まさに報道の大義！勇気を称えたい,144,🛸chko🛸,0
77,もっと報道して欲しい。私も三回目のワクチンを打って、10分程で半身が痺れました。注射を打った所も強く痛み、先生に訴えるとそんな直ぐに症状は出ないと。熱も39〜38度が4日続き、薬も効かずに本当に怖かった。幸いにも、私は一週間ちょっとで強い症状はほぼ消失しましたが、微熱、倦怠感、軽い目眩は続いています。四回目のワクチンは怖くて打てない…悩んでます。,256,0718acid,30
77-1,@koto その通りだと思います,0,Satomi
77-2,打たない。の一択ですよ。そもそもワクチン効果はあるの？確証、格率されてるとは考え辛いです。情報なんて上でいくらでも情報操作できますからね,1,中野家次女
77-3,@びび 様、毎日フツーに4000が亡くなってます。❕😂,1,宮田和博
77-4,@びび 様、コロ前が年間15000人で騒ぎに成ってからは8000人に減っていんのです。大したこと無いと言うことですね❗️,1,宮田和博
77-5,撃ったらダメでしょ🙅‍♂️,3,閑人のつぶやき
77-6,いけのり通信で検索してくれたら症状名の英語を日本語に訳してくれてます、でも本当に情報統制の厳しい事、すぐに削除されますから、何でも疑い、知識を得て知識武装して下さい、,4,ニーナニーナ
77-7,@すたみなたろう 頭にキャベツで笑う,9,ベス
77-8,何に悩んでいるか、整理しましょう。上司の圧力ですか？家族の反応ですか？貴方が行動することで、あなたの周りの方も救われるかもしれません。僕予想では四回目打つのは三割以下。どうせ間違って乗っちゃった列車を降りるなら、早いほうがいいです。,33,Keen Bobson
77-9,なんでそんな怖い目にあっても、4回目を悩むの？もしかしたら4回目の後遺症は何ヶ月も続くかもしれない。そして後遺症で苦しんでいる方々は有効な治療法を探っている段階なのに。,27,halmama
77-10,毒竹輪でなくなったかた既に7万人😢多すぎます。ニュースでコで亡くなった方１日4~5人。毎日4000人が他の事でフツーに亡くなってます。50人出ても１県あたり1人。😢それが大騒ぎする感染症なのでしょか❔亡くなった方には申し訳ないですが、ばかに少ないのですネ。⁉️,18,宮田和博
77-11,頭にキャベツを乗せる療法も効果的ですよあとメルカリにもグッズが売ってるのでチェックしてみてください,5,すたみなたろう
77-12,この567騒動以前から船瀬俊介先生の動画や記事を拝聴してましたのでハナからどんな💉も打つ氣は1ミリもありませんでした。何人もやめた方が良いと言ったのに自ら考えず良く調べもせず自分の身体を治験に捧げに行ってしまいましたよね。責めるてるわけではありません。氣が付いたなら、自分で調べ自分の頭で思考されて下さい。,52,T T
77-13,悩んでます。と、言う人は又打ちますよ。陰謀論ではありません。目を覚まして下さい。自分の体が悲鳴を上げてます。心配なら　血まなこになって　クグってお調べ下さい。お大事にしてくださいとしか　言えません。,62,Kiss Yukko
77-14,打たなくていいです。私は1回も打っていません。食生活を改善して免疫強化に努めています。コロナだけが病気ではないですから。,80,koto
77-15,打てば打つほど健康になれば良かったんですがね。これは、打てば打つほど不健康になっていく。,77,おかめ八目
77-16,@歌のお兄さま 厚生労働省のホームページにワク副反応データベースてものがあります頑張って見付けてください。すごい症例あがってますので,50,ランリンルン
77-17,打たない方がよいです！あたし一回目打ってかなり強い副作用、心筋炎みたいな感じになりもう怖くて二回目打ちません！💦,65,本城Yuuka
77-18,@rosafoetida14 膠原病の検査を受けてみてはどうですか？,15,けい
77-19,打たないでください。まずはデトックスをされることをお勧めします。,71,vivi
77-20,これ以上打ってはいけません！私は2回目接種から3ヶ月ほど経ってから、左半身に出る違和感に苦しめられています。足の裏や肩が時折痛むので、立ち上がるときには右手を突いてからでないと立てません。軽い倦怠感や息切れも出やすいです。このため3回目は打たないことにしています。,86,rosafoetida14
77-21,医者の言うことはワクに関しては聞かない方が良いですよ。そもそも治験中のワクですから医者も分からないので。,98,けい
77-22,WHOもアメリカのCDCとFDAも4回目接種の予防効果は2カ月しかないと報道しているので、打たなくて良いと思います🍀,72,y m
77-23,脱髄が起こっている人もいます。そうなったら普通の生活ができません。,49,インターロイキン10
77-24,3回目で危機を感じたのにどうして4回目の選択肢があるのですか？立場上、打たないといけないのでしょうか？感染予防効果も期待出来ないなのに。,121,ポンダー!!
77-25,@歌のお兄さま リンクを貼ると自動削除になるのであの単語で検索してみてください。あるクリニックの医師が載せてました。,53,A K
77-26,@A K ソース提示可能ですか？ぜひ読みたいです。,19,歌のお兄さま
77-27,打たないでください。「1291もの有害事象リスト」と既に出てます。,119,A K
78,苦しんでいる方の現場を見ているからこそ、リアルで心に響く真の報道と感じました。全国でも極稀な報道機関、日本の正義の味方です！感謝！,22,5人のママちーちゃん,0
79,男性アナウンサーの方の勇気ある発言に感謝します。サンテレビさん応援しています。,5,マンボ,0
80,今、報道規制の強い中誠意ある報道をして頂き有難うございます🙏💕。サンレテビニュースさんの報道を見て、多くの方々が早く気付いて下さり、被害を回避して変わらね健全な日常生活を送って下さることを心から願っています。感謝致します🙏❤️。,5,りこちゃん,0
81,この概要をご覧ください！！！！　サンテレビのスタッフさん、凄いです。文字起こし付き、有難うございます。そして、こういう取材が欲しかったぁぁぁ！！！両方の問題について取り上げて下さることは、どっちが良い悪いで終わるのではなく、非難の応酬にせずに、双方の問題として（予防接種すべき・ダメとか、感染したら大変・しても風邪）考えていくきっかけになるかもしれないなと思います。実際に、どちらのしんどさを抱えている人達がいますので。,63,Maya Saijo,0
82,勇気を出して発言して下さりありがとうございます！誰もワクチン後遺症の事を取り上げてくれるメディアはありませんでしたが、サンテレビが伝えて下さり嬉しかったです。ファンになりました！これからも応援してます🎵,6,kaori n.,0
83,アナウンサー様！渾身の想いを込めて、被害者に寄り添う勇気の報道に感謝致します！どれだけ、被害者の心が救われているか知れません！私もセミナーを通して、地元に訴えて行きます！,4,小林なおみ,0
84,公平な報道をありがとうございます！初めて信用できる報道を見た気がします。応援しています！,6,hoshizola,0
85,最後の言葉、感動しました🥲感染後の後遺症は、味覚臭覚の軽症でしかも治って良かったですね✨💉後遺症の方、善良な医師に巡り逢えますように。,40,k yoshida.,0
86,拝見して涙が出ました。勇気ある真実の報道をありがとうございます。これからも一部の権力に阿ることなく、マスメディアの鏡としての報道をお願いいたします。,13,yukky ssik,0
87,確かにCBC TVとサンテレビさんだけは、真実の報道してくれてます。頑張って下さい。応援してます。,10,ペコタントム,0
88,この、男のアナウンサー素晴らしい。勇気をもって報道してくれたことに感謝。,6,のはすぎ,0
89,正しい情報をありがとうございますワクチン後遺症で苦しむ方が早く救われますように国が否定しないで救けてあげてください。たすけられないなら無責任に国民に推奨しないでほしい,4,まき,0
90,YouTubeを観ている方達だけしか理解していないから、この真実をテレビでもっと詳しく報道すべきです！,46,りんりん,0
91,素晴らしいと思います。苦しんでいる人、沢山いると思います。メディアでしっかりと真実を伝えてもらいたいです。,15,H,0
92,大変勇気のある報道、本当にありがとうございます。,8,みむらみき,0
93,副反応どころか、月曜日に知人の元気なお母さん（73歳）が3回目の摂取後、少し熱があると言っていたら亡くなりました。みんないい加減目を覚ました方がいいと思います。,118,情弱じじいCH,4
93-1,ほんそれ,6,中野家次女
93-2,本当に早く目を覚ましてほしいです。😥,24,カフェオレ
94,このようなほかが、報道されないニュースを取り上げてくれて、感謝しています。今後も引き続き続けてほしいです。,2,suzuki ran,0
95,コロナ関係の報道に疑問を感じて一年程前からほとんどテレビを見なくなりましたコロナ死亡や後遺症は大騒ぎなのにワクチン死亡や後遺症はスルー偏り過ぎですCBCとサンテレビさんだけは国内で貴重なまともな報道機関だと思います残念ながら私の地域ではまともな報道機関は有りませんテレビでCBCとサンテレビの番組が見たいです,19,さとちゃんあきちゃん,1
95-1,ABCや広テレとかも報道していました。,2,rosafoetida14
96,勇気ある報道ありがとうございます。東京在住です。高校生の娘が接種後から体調不良が続き秋から学校を休んでいます。先週厚労省と東京都のワクチン窓口と区の副反応ダイヤルに電話したが何の進展もありません。早く神戸や名古屋のようにワクチン後遺症相談窓口を開設してほしいです。若い娘の未来がこれからどうなるのか不安です。これからも応援していますので、偽りのない報道を続けて下さい。,74,ゆかぴよ,4
96-1,ありがとうございます！有志医師の会、さっそく検索して連絡してみます。今は何より情報がありがたいです。本当にありがとうございます。,3,ゆかぴよ
96-2,東京こそ、窓口設置して、ちゃんと対応して追跡調査すべきですよね！あんなに打っているんだから、具合悪い人が少ないわけがない！全国有志医師の会が後遺症窓口設置しています。東京は5つくらいの病院が載っていました。是非そこにご連絡してみて下さい。ご家族もお辛いですよね。一日でも早く娘さんがお元気になられることを願っています。,7,永遠のレシーバー
96-3,都知事・小池が都民をニラとしか見ていないことが解ります💢,7,rosafoetida14
97,ワクチン後遺症の事をやっと伝えてくれはって、心待ちでした。こちらの番組のようにもぅとメディアが伝えて頂きたいです。ありがとう！,137,裕美子 秋元,0
98,勇気ある報道ありがとうございます。これからもよろしくお願いします。,40,koto,0
99,サンテレビの姿勢に感動すら覚えます。兵庫県民の誇りともいえるテレビ局ですね。,3,パルちゃんねる,0
100,ワクチン💉接種を📺で煽るだけ煽って、相当数の後遺症患者さんや、亡くなられた方々の事を思うと胸が張り裂けそうです😭😭😭本当に絶対許せません💢どうか、この番組を全国民に広めて行って頂きたいです😭,5,roulette,0
101,ワクチンを受けた後の後遺症がまだ認知されてないからもっと報道してほしいです。,2,kagura,0
102,このような報道をしてくださるテレビ局があって、びっくりです。うれしくて涙が出ます。私の見ているテレビ局はどこもかしこもワクチン接種をあおるものばかりです。アナウンサーの方もきっと、勇気がいたことでしょう。心から感謝いたします。これからも真実を報道していただきますよう、お願いいたします。心から応援いたしております。,14,雪の華,0
103,締めくくりの言葉に涙が出ました（後遺症についての事実を一部の曲、しかも地方局しか伝えないのか…）被害に遭っている方々の気持ちを考えると悔し涙が出ます,23,MoHi,0
104,ありがとうございます。本当にその通りだと思います。勇気ある発言に胸打たれました。,3,海空,0
105,このような報道ありがとうございます。高齢者の方への情報提供に役立ちます。ネットの情報のみですと信頼性にかけると思われてしまうようで聞く耳を持ちません。,140,みっきーみっきー,1
105-1,ジーちゃんバーちゃんは驚くほどテレビ見てますね。cbc、ABCも一緒に紹介すれば、考えるきっかけになってくれると思います。,2,Keen Bobson
106,アナウンサーの方の最後のコメント、まさにそれです。何故地方のメディアしか報道しないんですか？　自分的には、地方の方が接種後の副反応や死亡者数が多い気がしますが、追跡して教えてくれるメディアはいないでしょうか。何故？どうして？どうすれば？を考える国民になりたいです。,87,A K,3
106-1,その通りですね。国民の命を軽視した日本人と思えないメディアの偏向報道。大手メディアはもう日本人じゃないのかもしれません。藤TVなんてもう韓国かと思うような内容ばかり。参政党の演説は真実を語って下さってて、日本を取り戻さなくては！と熱く思いました。この男性アナウンサーの方の言葉に感動して涙が出ました😭,9,coco
107,勇気ある報道、素晴らしいと思います。,9,tuk08344,0
108,ワクチンを接種した人がコロナに感染しやすく後遺症が酷くなってるのかも検討してもらいたいな。,76,りー,0
109,素晴らしい報道です。そして最後のコメント、泣きそうでした😭  有り難うございます🍀応援してます。頑張って下さい。,5,アロマ1018,0
110,男性アナウンサーの方の勇気ある最後の発言に感謝します。サンテレビさんありがとうございます🙏,21,おたき,0
111,事実に則した報道ありがとうございます🌟これからも市民側に立った報道よろしくお願い致します🌟,3,Orange Apple,0
112,本当に知りたいのは、みんなに知って欲しいのはこういうこと！サンテレビさん、ありがとうございます。そして、最後の藤岡さんの言葉、勇気を振り絞って伝えてくださり、ありがとうございました。涙が出ました。感動しました。この現実を知らない人の為に、やはりメディアが何度も何度も真実を伝えることが重要です。どうかこれからもよろしくお願いします。心から応援しています！！,23,永遠のレシーバー,0
113,全国、、いや、世界中の大手メディアが本当のことを伝えない中、血の通った報道をありがとうございます。他も正気に戻り、本来のあるべき報道を心がけてほしいのだが、、。,3,hrsk .w,0
114,藤岡アナウンサーの言葉に涙が出ました。ありがとうございます。サンテレビさん！頑張って下さい！応援してます！,11,りえ,0
115,コロナ後遺症の人がワクチンを接種済みかを言って欲しいと思いました。接種してないときは、未接種と強調するのに。接種してるからあえていわないのでしょうか,24,Michiko N,0
116,最後のコメントに感動しました。,142,gis yumi,0
117,素晴らしい、メディアの鏡。メディアは内側から、正義と情熱、愛を持つ者によって変わっていく。応援いたします！,17,mondk'nt,0
118,素晴らしい情報有難うございます。私も一回目のワクチン接種後1分以内に打った場所の皮膚の中から激しいかゆみと呼吸困難で救急車をもう少しで呼ぶ羽目になりました。それ以来頭がぼーっとなっています。それ以降は接種怖くて受けていません。何かあっても誰が保証してくれるのでしょうか。私も極度の化学物質アレルギー者です。,4,Kaori S,0
119,この様な重篤な副反応が起こり、後遺症で苦しまれてる方の報告が上がってきても接種を止めないのは、政府からすれば想定内の出来事だからなのでしょうね。,4,じーつー,0
120,闇のダディさんのお陰でこの番組を知ることができました。中立的な報道と藤岡アナウンサーの思いやりのコメントで感激して、番組登録させて頂きました。これからも中立的な報道に期待します。,20,さっちゃん,0
121,嬉しくて心が震えました。モリカケ問題から政府が信じられないと思うようになり、コロナワクチン問題やロシアウクライナ問題でメディアが信じられなくなりました。まだ日本も捨てた物ではありませんね。ありがとうございました。,4,Yukie Kanda,0
122,このアナウンサー素敵!是非どんどん政治の件も伝えてほしい！,16,もぐたんもふたん,0
123,『ダディの学び舎』というダディさんのYouTubeで紹介されていたので福岡からですが応援させていただきたくこちらのYouTubeを見させていただきました。正しい情報を伝えてくださっている藤岡アナウンサーの勇気に頭がさがります。上が用意した『打ってください』原稿をそのまま調べもせず読むだけの全国のアナウンサーに見ていただきたいです。感動しました。,31,カズノッチ,2
