123-1,特に在京キー局。アナウンサからの内部告発がこれから起こり得ると想像します。ほとんどのアナはお上の命令にいやいや従っているだけです。,1,rosafoetida14
123-2,自分が読む原稿に修正かけられるアナウンサーって、どれらいいるのだろう？大御所様はできるだろうけど、イヤイヤ喋って苦悩するアナウンサーもいるだろう。有志報道者の会とか、できるといいな。,4,Keen Bobson
124,他のテレビ局が偉そうに報道の自由や正義を語る権利はありません。サンテレビさん、頑張ってください。,2,苑子,0
125,伝えるという報道、素晴らしいと思います。,5,りんちょ,0
126,国がワクチンを推奨しているのだから責任をしっかりとるべきだと思います,6,モカっち,0
127,神戸市長がこの問題はあまり認知されていないと言っていたが、国の圧力があるのか知らないが、殆どのメディアが報道しないから知らない人が多いのだろう💢もっとこの問題を積極的に報道して下さい。,5,原田博之,0
128,公平に報道しようとする姿勢が素晴らしい❗️他の局もちゃんと報道してほしい❗️,8,上野えりか,0
129,ありがとうございます！何を報道すべきか。本当の意味で国民の為になる情報とは。その嘘が付けない勇気ある姿勢に感謝します。世の中の意図的な酷な国策、仕組みを分かった上で言える言葉を仰ってるとは思いますが。多くの方々が気が付きはじめてるように全てご存知なんだろうなと必死さが伝わり泣けてきました。  なぜ1部の利権、目的のためにこんな苦しまなきゃいけないのでしょう。神戸市長も姿勢、変わって欲しいです。くれぐれもお身体にはお気をつけ下さい。,28,RUNA,0
130,ワクチンのメリットとデメリットをわかりやすく説明されている医師は全国に何人いるのですか。,41,綾小路真,2
130-1,目立たないだけで、無数にいます。,8,rosafoetida14
131,ワクチン推奨の報道ばかりの中、真正面からクチン後遺症について声をあげて頂き有り難うございます取り組みが大きく拡がり今扇動の他の情報番組もワクチンの真実に即し追従してくれる日を心待ちにしています,26,蒼蒼,0
132,今のこの異常な時代に本当に心ある調査報道なさる希少な局ですね。感謝しかないです。とても分かりやすい内容。被害の深刻さや被害者置きざりのワクチン運営の実態が見えてくる。報道の鑑。どうかこの姿勢を続けて日本国民を助けてください。応援してます。,16,SORA NAKAJIMA,0
133,素晴らしい報道ですね！アナウンサーの方や番組関係者の勇気に 感謝します‼️,3,Kazuko Tojo,0
134,勇気ある報道に感謝です🙇,6,てるてる坊主,0
135,これからもっともっとこうゆう事例が表に出来くるね,6,医療系サラリーマッチョのり,0
136,いいね、コメントでこの報道をもっと目立たせたい！勇気ある、そして心から訴える男性アナウンサーさんの声に賛同します。ありがとう。,4,k ki,0
137,打ってから具合い悪くなっても因果関係曖昧にする政府。苦しんでる人たちのこと自分の身内のように考えてほしい😢,99,美沙,2
137-1,我々はモルモットです,0,中野家次女
137-2,実験用のマウスの生死なんか誰も興味はないだろ？そういうことなんだよ,6,正体不明
138,素晴らしい報道姿勢です。特に最後の締めのお言葉は拡散すべきコメントでした。ありがとうございました。,3,masahiko tatsumi,0
139,素晴らしいとしか言いようがありません。よくぞ言って下さいました。サンテレビさんとアナウンサーさんの勇気に感謝します。この波紋が大きなうねりになり、国を動かし、苦しんでいる方々が少しでも楽になりますように。,1,ユカリン,0
140,この男性アナウンサーは何という方ですか？この方も副反応で苦しむ人に寄り添い、勇気を出して発言されていると思いました。応援します。,7,Naominten,0
141,チャンネル登録しました。利権に塗れないで自分の言葉で発信してくれる藤岡アナは、私達の真の代弁者であると思う。こういう報道なら応援したいです。,2,月藍子,0
142,私も昨年の8／16に1回目のファイザーワクチンを打ってから１時間後にアナフィラキシー、吐き気、食欲不審等今4月ですが、吐き気と倦怠感等に悩まされていますかなり痩せました血液検査しても別に異常はありませんしかし、今まで食べていたものにアレルギーを起こしたりしてほんと苦しい思いをしています県の相談センターに連絡してもそんなことがあるんですか？とかまだ調査がはっきりしていないのでわかりませんという返事で情けなかったです医療費はかかるし仕事も体調崩しても勤務しています本当に苦しく辛いですいつになったら元の元気な体に戻るのか教えては欲しいです,8,いずみママ,0
143,藤岡アナ、スタッフの皆様、真摯な報道ありがとうございます。私は　北海道在住者ですが、道内では、全く報道されてません。情報弱者で、あふれかえってます。北海道は　本州よりもワクの接種が遅く、様々な反応事例も遅い為、周りは気づいてない状態です。藤岡アナの最後のメッセージ　心に響きました。　ありがとうございます。弾圧もあると思いますが　応援してます。,7,ёYo-Koё,0
144,せっかく良い報道をさるているのですから、サンテレビさんは感染者数のニュースを正しく【陽性者】とする方が良いと思います。もはや感染者という表記が正しくない事は素人の私でも知っているくらいですから…。,29,ptw,0
145,陰謀論者でも何でもないけど、そもそも具合い悪くないので射たない。いまだ未接種。インフルの予防接種すら射たないけど、風邪すら全くかからない強靭な免疫力に感謝。,51,rideon,0
146,アナウンサーさん、テレビ局さん、よくぞ放送してくださいました。今後もどうか本来の意味のメディアとして報道していってください。どうかお願い致します。この放送で救われた方が多いと思います。ありがとうございました。,12,echo Sabai,0
147,メリットが上回るなら打てって。。。打たなきゃどうなるかわからないのに結局は自己責任。責任取れないならなら過剰に推奨するべきではないですよね。実費にして公平な情報を出して打ちたい人が打てばいいんです。いまは情報が偏りすぎているしとにかく打て打てな政府、自治体、専門家の異常さがぬぐえない。,31,tetu,0
148,愛知県民です。キャッチいつも見ていましたが、大石解説に感動してチャントに乗り換えていました。キャッチも応援していきます！愛知県はワクチン後遺症の対策が始まってますから、メディアもやりやすい面があるのかな。,6,くうぽん,0
149,すぐに医者にかかったり、クスリを飲むのを止めれば、健康になるし、長生きが出来る。製薬会社や医者の金儲けの犠牲になってる事にいい加減に気が付くべき。人間は無数の薬を作っても、無数の病気に苦しんでる。,4,サニー大山,0
150,サンテレビさん、そして藤岡アナウンサー勇気を出して報道してくれてありがとうございます。全国テレビでは触れもせず、ワクチンを推し進めるだけの報道ですね。メディアを信じられなくなってすっかりテレビを見なくなりましたが、とあるYouTuberさんのお陰でまだ捨てたもんじゃないな、と涙が出ました。サンテレビさんとCBCさんの報道は偏りがなく、真実を伝えてくれています。メディア、政治、色んなしがらみがあるかと思いますが、どうか国民に真実を伝えてくれる事を願います。,5,ns,0
151,もうメディア全く信用しなくなっていたのですが、こんな局があったのですね！どうか大手に潰されず、スポンサーに製薬会社からの圧力がかからず、こういった番組が継続できることを願います。,8,☆RIEKO☆,1
151-1,もしスポンサーたる製薬会社が圧力をかけてくるのなら、局として、当該製薬会社を刑事告訴することも本気で考えるべき。毅然とした態度を!!,0,rosafoetida14
152,素晴らしい局ですね。私もワクチン後遺症で極度の耳鳴りと帯状疱疹に似た皮膚炎であちこち受診しましたが結局どこの医療機関でもワクチン後遺症とは認めてくれませんでした。言われる事は気のせい、たまたま重なっただけとかです。ワクチン打つ打たないは本人の自由なので皆さんはよく考えて接種して下さいね。ただ私から言える事は何が起きても国も医療機関も絶対後遺症とは認めてくれないので諦めてください。,37,びぃ,0
153,確かにクルーズ船の時は強毒であったが、弱毒化が進んだオミ株でどれだけの後遺症があるのか、データを出してほしい。また、現在後遺症で悩まれてる方は、「全国有志医師の会」を頼って欲しい。後遺症は症状が多様で治療法のデータ蓄積も無く手探り状態だが、この会の医師達は少なくとも患者さんを真摯に診てくれる筈です。最後に男性アナさん、HP見たけどお名前がわかりませんでした。心からの発言だと、表情と声でわかります。世論を変えるのは、継続と私欲を捨てた誠実です、感謝のメールを局に送ります。,42,Keen Bobson,0
154,素晴らしい！！！　この方を失脚させるような事が起こるようなら、もう絶対にサンテレビは観ません！,4,Eriko Miyagi,0
155,ワクチン自体が人体にどう働くか良く分かっていないので、もし後遺症が認められたとしても治し方が分からないですよね。それが怖くて打てないです。コロナの後遺症も分からないけど、他にも予防法はあるから安全な予防法を私は選びたいです。,5,mari mari,0
156,両方の情報を提供して頂いているのが、ありがたいですね。子宮頸がんワクの時から何かおかしいと思って、結局コロワクは治験中なのでやっていませんが、今では、赤ちゃんに実施するワクに何が入っているか不審に思っているくらいです。現時点で関係ないので添付文書は見ていません。今回の騒動で日本の食品添加物1500程で支配層が住んでいると思われるヨーロッパの30〜60程度と比較して桁違いに多い事がわかりましたし、日本の食品は農薬も結構使われているし、調べれば調べるほど、色々な事がわかったのが有益だったと思います。また、何かおかしいと思ったら、立ち止まって調べる癖をつける事が重要かと思いました。,11,クルクラット,1
156-1,農薬より堆肥の方が安心。,2,rosafoetida14
157,後遺症を患って苦しんでいる方々のために発信くださって感謝いたします。最後の勇気あるコメント素晴らしかったです ♪主要オールドメディアは見る気失せる今日このごろ。,5,kirara hoshino,0
158,病院勤務していた昨年は、シェディングで関節痛・手足のしびれ・不眠・蕁麻疹、そしてセブンのコーヒーのニオイがうんこのように感じられました。加齢の成果と思いましたが、辞めたら治りました！,40,VG,1
158-1,ちょっと書き方が笑😅でもシェディング らしきものは私もありましたワクチン接種したばかりの人が近くにいると生理のような出血と腹痛が続きました不思議なことに休みの日はなんともないんですそして休み明けに接種者と同じ空間にいたらまた生理のような出血と腹痛夫はある日から動悸がしたり体調が悪いと訴えるようになりましたそれは私が2020年5月にワクチンを接種してからでした,4,空マンハッタン
159,偏向報道ばかりの見る価値もないニュースばかりのなか、隠されている問題をしっかり取り上げてくださってありがとうございます。,33,a a,0
160,あくまでもコロナワクチン擁護の風向きになびくメディアの多い中で、いまや社会的弱者としてコロナワクチン後遺症で苦しむ方々の困りごとの事実をありのまま伝えようとする数少ない報道に感謝です❗️❗️これからも、現場の状況を真摯に伝えてください❗️❗️期待しています👍😊,3,上野えりか,0
161,ウイルスへの抗体の為のワクチンで人体に影響が全くないはずがない。熱が出るのは副反応として認めるけど、後遺症は認めない…とか、矛盾してるよね。私は後遺症は無いが、20年近く3日以上ずれた事無かった生理周期が10日以上早まった。その後はその周期で落ち着いたが、ホルモンへの影響もあるんじゃないかと思い、妊婦さんの接種とか心配してしまう…。,31,maippuh,1
161-1,自分は今まで28日以内に生理が早まったことがなかったのに3日も早くきたときは更年期かぁ？と思いました。ワクチンのせいもあったのでしょうかね🤔ギリギリ30代です。,0,みこ
162,今のテレビやメディアは真実を伝えていないこのテレビは素晴らしいです🤗応援したいです❗️,4,深尾恵子,0
163,「どっちの後遺症もある」と言えば自分が「どちらの」後遺症なのか攪乱できるしな。ほんとうまいことできてる。メディアはもう全て価値がない。,46,ckzonex,0
164,原因不明は全部救済しないとね　分からない物を打たせたんだからね　自己責任なら打つ前にこれで何が起こっても補償ありませんよとB4用紙の表表紙にそれ書いて署名させておくべき　因果関係が無いと証明できなければ全部責任負うべき　　そうでないなら打たせるな,8,なかとむ,0
165,副反応で報告されてないケースたくさんありそうです。私の身近な人も若いのに打ってから帯状疱疹になりましたが、報告データベースにはそれらしい報告が見当たらなかったです。2021年なので報告されてたら載っているはず…,36,mi na,0
166,岸田首相の、魂の抜けた心の無い言葉に苛立つ。大丈夫か…人として。一方、藤岡アナのキリッとした目、しっかり意見を言う姿勢に、大変好感を持ちました。ありがとうございます🙏登録しました🔔*ᴗ ᴗ)⁾⁾⁾,22,CHIEMI ISHII,0
167,死者1500人以上出てて1件も因果関係ないのはおかしいこういったところがきちんとしてないから打ちたくない人が増えるんだよな,97,アビス,2
167-1,ねぇ～、深い内容分かっててそうしてるんだから、もう鬼畜の所業、、,19,donnahide
168,最後のアナウンサーのコメントが熱い！！　感動しました,14,Jose_Kamala,0
169,この放送を見てチャンネル登録し番組拝見する様になりました。勇気あるコメントをTVで聴ける事を諦めていました。応援しています。TVしか見ない人、ネットも見る人、両者で分断も起きています。色々な視点で今日本で起きている現実を特集して下さい,3,目が点,0
170,マスメディアの仕事をしっかりされています。今後ともよろしくお願いします。,17,ナマケナイナマケモノ,0
171,メディアは一方的な見解しか放送しない、と失望していましたが、よくぞ発信して下さいました。多くの方に見て頂きたいです。ありがとうございましたm(_ _)m,2,なべなべ,0
172,応援してます。本当に、ありがとう御座います🥲,6,i ken,0
173,ワクチンの後遺症かどうかわからんけど、もう3か月以上左前腕部分だけが、異常に痛い。筋肉痛のかなりひどいような痛み。打つ前はこんな痛みなかったからつらい。,54,mata Channel,8
173-1,@うんちゃん 怖い事言わないで😅もう治らないと思うとワクチン接種した事、後悔しかない。,0,mata Channel
173-2,@ハッピー 同じく伸ばしたり曲げたりするたびに痛みます。筋肉痛かと思っていろいろ貼ったり塗ったりしてみたけど効果ゼロだから筋肉痛じゃないと気付きました😣もうワクチン3回目はやめとこーと思ってます。,0,mata Channel
173-3,私も痛いです。調べたらsirvaという状態みたいです。筋肉注射を、失敗されたのだと思います。腕は伸ばしたり捻ったら痛い程度だから諦めてます。,2,ハッピー
173-4,@Erai コロナ後遺症については「無症状感染して後遺症だけ出る」「肥満、抜け毛」等の信じ難い報道があったので、フェイクかと思ってました。完治をお祈り申し上げます。,1,Keen Bobson
173-5,接種したら自己免疫疾患になる可能性有りますから、症状有るし検査されてみては？,8,けい
173-6,二、三年後はもっと酷い事になるよ,8,うんちゃん
173-7,私の場合はコロナの後遺症ですが、約半年間会社を休んでいましたが現在は7割程改善して復帰しております。残っている症状は何とも言えない筋肉痛と筋力の低下でしょうか．．．mata Channelさんはたぶん接種後の後遺症でしょうね、お察しいたします。,9,Erai
174,危険だと医師の説明を聞いていたのに自筆署名してまで人体実験に参加頂きかつ自己責任の下で治療費も自費負担して人類の未来に貢献頂き感謝してもしきれません。僕は小心者で医師からの説明を受けて怖くなり武漢ワクチンを打たずに帰った卑怯者です。ありがとうございます。,13,いつも運がいい無線技術者,0
175,こんなに被害が出てきているのに推進の立場を変えられない厚労省は誰に忖度しているのか？ どこから圧力をかけられているのか？,81,ariesrie,4
175-1,一般人も。率先して反ワク等と馬鹿にする人も。同調圧力する人も。,3,さゆ
175-2,WH○とかビ○ゲ○ツとか世界の財団ですね。,13,ランリンルン
175-3,国際金融資本、米国内ネオコン、中共。以上から圧力をかけられていると疑うべき。,21,rosafoetida14
176,アナウンサーさんがここまではっきりコメント出来る！放映する！素晴らしいです👍✨,98,obatarian sanuki,0
177,どこまで行っても自己責任！目覚めるのが遅すぎた。国は絶対に責任をとってくれません。歴史は繰り返すんだよ。国民を殺すメディアと政府。悲しいけど仕方がない。目覚めない同胞ばかりで悔しい。。,60,松奈良一,3
177-1,同調圧力で追い詰める一般人、反ワク陰謀論者等と揶揄して中傷する一般人も。こういう人達は最初から安全圏からものを言って、更に隠れられるから質が悪い。,3,さゆ
177-2,完全に同意します,7,イワナ番長
178,男性アナウンサーの最後の言葉は泣けてくる,4,ーべ,0
179,最後のコメント、感動しました❣️勇気ある報道をありがとうございます‼️,7,竹内洋子,0
180,真実の報道をありがとうございます,8,ri ma,0
181,枠沈後遺症の方はD-ダイマー検査を受けられ血液精密検査にて好酸球％を調べられれば異常有りの結果が出る可能性があると思われます。,14,H J,0
182,まさか、このサンテレビがこのニュースを流してくれるとは、夢にも思っていませんでしたが、よくやりました！これからも、もっと流し続けて、アレの🙅‍♂️な所を教えてあげてください！,2,たう,0
183,ファイザーとの契約事項もしっかり報道して欲しい。海外での報道も大事です。今ファイザー製薬は訴訟をおこされてますし、少しずつファイザーの資料が公開されています。副作用だけでも1290種類確認されています。ファイザーが発表しています。そう言った真実も報道してほしいです。,8,吉春,0
184,素晴らしいです‼感動しました😭他のメディアも続いてほしい‼,6,りやん,0
185,素晴らしい！これからも真実を伝え続けてください。権力にへつらう大多数のマス○ミと違うスタンスに敬意を表します🙏,3,閑人のつぶやき,0
186,素晴らしいニュースメディアがまだあったんだと感激しています。,5,Toshio BAN,0
187,兵庫の放送局なんですね。素晴らしいです。全国放送は真面目な顔して適当なことしか伝えていないと思う。このような誠実な報道を見ると、全国放送ニュースなんて見る気失せますね。,4,ronron7972,0
188,ワクチン後遺症の報道は他では見たことがありませんでした。たまたまですが欲しかった情報に触れられありがたかったです。,2,トッキー,0
189,素晴らしい！サンテレビさんありがとうございます！,92,元の日常チャンネル,0
190,地上波でちゃんと報道されているところがあったのですね。偏った報道のみばかりと感じるので素晴らしいです。少し安心しました。,3,so Yamao,0
191,うわあすごいなサンテレビ。これを見たかったんだよ,19,and,0
192,ありがとうございます😭言葉にならないほどに感動してしまいました。メディアとしてのプライド観させていただきましたよ！サンテレビさん、どうもありがとうございます🙏,16,mint ami*,0
193,関西のTV報道は良心的ですね。関東ではこんな報道まず無いです😓,46,y m,1
193-1,キー局は報道統制されている電通やCMのスポンサーが殆ど製薬会社系な為です‼️でも昔から統制されていた事にコロナ報道によって気が付く事が出来ましただから特に大好きだったワイドショーは全く見なくなりましTVはドラマ位ですね,7,【asukotaTV】公式
194,藤岡アナウンサー、よく言った！その言動は必ず、副反応や有害事象で苦しんで方々の心の支えになります！,7,Kuma T,0
195,コロナ感染後遺症は沢山あるね!しかしコロナワクチン接種して副作用も沢山あるよ!接種後2日間全身の激痛、そして寒気が1ヶ月!鼻血固まらりはなずまり。、次は心臓不都合、４回目は死にたくないから拒否だな😰,18,鉾マックス,0
196,コロナ関連の報道ではじめてまともな意見を聞きました｡ありがとうございます｡,9,Eri S,0
197,私は3回目摂取から1ヶ月が経過しましたが、まだ頭痛と倦怠感が続いてますそれを言うと、周りからは花粉症のせいじゃないかとか、低気圧のせいじゃないかとか言われますそれらの影響がゼロとは言えんけど、ワクチン翌日から、ずーーーーっと、一度も痛みがおさまらずにいるのよ。薬が効いてるときは痛みはだいぶ収まってはいるけど、それでも無痛にはならない。1、2回目は、3日めには復調してたんですけどね。,3,秋山,0
198,主要メディアに対しての製薬会社関連からの圧力を感じてなりません。言えないんでしょうね．．．数日前に東京のあるテレビ局の記者さんとお話しする機会がありました。局の人でも未接種の方はいるそうですが、接種に対するマイナスイメージの報道は現状ご法度のようです。ハッキリと言っていました。,55,Erai,1
198-1,製薬会社と国際金融資本の不審な関係を白日の下に晒すしかないでしょう。今は、国際金融資本が本家と分家で、さらには分家同士でも対立しているので、弱体化の兆しが見えてきています。そうなれば、製薬会社も圧力をかけづらくなっていきます。,9,rosafoetida14
